{
  "schema_version": "1.0.0",
  "model_version": "retinaface_r50_glintr100_v1",
  "preprocess_version": "v1",
  "detector": {
    "name": "retinaface_r50",
    "input_layout": "NCHW",
    "color_order": "BGR",
    "input_tensor_name": "input",
    "input_dtype": "float32",
    "input_shape": [1, 3, 640, 640],
    "dynamic_profile": {
      "min": [1, 3, 640, 640],
      "opt": [4, 3, 640, 640],
      "max": [8, 3, 640, 640]
    },
    "output_tensors": {
      "location": "loc",
      "confidence": "conf",
      "landmarks": "landms"
    },
    "confidence_threshold": 0.5,
    "nms_threshold": 0.4,
    "max_candidates": 300,
    "anchor_strides": [8, 16, 32, 64, 128],
    "anchor_sizes": [[16, 32], [64, 128], [256, 512]],
    "anchor_ratios": [1.0],
    "variances": [0.1, 0.2],
    "landmark_order": ["left_eye", "right_eye", "nose", "left_mouth", "right_mouth"]
  },
  "recognizer": {
    "name": "glintr100",
    "input_layout": "NCHW",
    "color_order": "RGB",
    "input_tensor_name": "input.1",
    "input_dtype": "float32",
    "input_shape": [1, 3, 112, 112],
    "dynamic_profile": {
      "min": [1, 3, 112, 112],
      "opt": [8, 3, 112, 112],
      "max": [32, 3, 112, 112]
    },
    "output_tensors": {
      "embedding": "1333"
    },
    "embedding_dim": 512,
    "normalize": "l2"
  },
  "alignment": {
    "template": [
      [38.2946, 51.6963],
      [73.5318, 51.5014],
      [56.0252, 71.7366],
      [41.5493, 92.3655],
      [70.7299, 92.2041]
    ],
    "crop_size": [112, 112]
  },
  "models": {
    "retinaface_r50_dynamic": {
      "onnx_path": "backend/artifacts/models/retinaface_r50_dynamic.onnx",
      "onnx_sha256": "fd8a87a6f2837d425604e0f88efca91e661947dbc3707f54da53ec27a8dc9a8a"
    },
    "glintr100": {
      "onnx_path": "backend/artifacts/models/glintr100.onnx",
      "onnx_sha256": "4ab1d6435d639628a6f3e5008dd4f929edf4c4124b1a7169e1048f9fef534cdf"
    }
  },
  "engine_manifest": {
    "retinaface_r50_dynamic": {
      "engine_path": "backend/artifacts/engines/retinaface_r50_dynamic.bs1.opt8.max64.fp16.trt1016.engine",
      "engine_sha256": "f6933cbcfd32681d285ac04dc688bea7a017ac5837635dd4a59c059d3959991f",
      "profile": {
        "min": [1, 3, 640, 640],
        "opt": [4, 3, 640, 640],
        "max": [8, 3, 640, 640]
      },
      "precision": "fp16"
    },
    "glintr100": {
      "engine_path": "backend/artifacts/engines/glintr100.bs1.opt8.max64.fp16.trt1016.engine",
      "engine_sha256": "6128324c87a259992047e08d84210d8f18467301750ee27bee27d504793cbb53",
      "profile": {
        "min": [1, 3, 112, 112],
        "opt": [8, 3, 112, 112],
        "max": [32, 3, 112, 112]
      },
      "precision": "fp16"
    },
    "build_command": "trtexec --onnx=<onnx> --saveEngine=<engine> --fp16 --minShapes=input:<min> --optShapes=input:<opt> --maxShapes=input:<max>",
    "tensorrt_version": "10.16",
    "cuda_version": "12.8",
    "container_digest": "nvcr.io/nvidia/tensorrt:26.03-py3@sha256:ade1b30517b3d66b911a3cd7faf0146484ab8956098abe66b96b944fa36f4861",
    "gpu_compute_capability": "TBD",
    "gpu_uuid": "TBD",
    "build_timestamp": "TBD"
  }
}
